{
  "schemaVersion": 1,
  "benchmarkId": "benchmark-v7-luna-xhigh-n3-2026-09-01",
  "blindId": "vz-626a27",
  "scenario": "small",
  "workspaceCommit": "a503e508bce07ea4a33646405e2a9416a47afe9d",
  "setupCommit": "a503e508bce07ea4a33646405e2a9416a47afe9d",
  "contractSha256": "10065386fb43e22c2065d6a1049af29f7a10a139707166e9e0947309a0e760be",
  "reviewPasses": [
    {
      "reviewerId": "v7-review-vz-626a27-a",
      "total": 29,
      "checks": [
        {
          "id": "S3-C01",
          "pointsAwarded": 6,
          "evidence": [
            "Validation is centralized in src/lib/outbound-actions.ts:58-71 and called before delivery creation in src/services/registration-service.ts:500-508."
          ]
        },
        {
          "id": "S3-C02",
          "pointsAwarded": 4,
          "evidence": [
            "The method registry is defined in src/lib/outbound-actions.ts:3-7, reused by src/config.ts:5 and src/config.ts:25-26; routes and workers forward generic method/payload values without duplicating schemas."
          ]
        },
        {
          "id": "S3-C03",
          "pointsAwarded": 4,
          "evidence": [
            "Unit coverage exists in test/outbound-actions.test.ts:5-59. Integration coverage exercises queueing, validation, duplicate idempotency and conflicts in test/integration/gateway.integration.test.ts:253-411, with send/status coverage at lines 91-251."
          ]
        },
        {
          "id": "S3-C04",
          "pointsAwarded": 3,
          "evidence": [
            "Adding a default method is localized to the registry in src/lib/outbound-actions.ts:3-7; method-specific validation can be added in the same module, while src/services/delivery-service.ts:477-481 already dispatches generic methods."
          ]
        },
        {
          "id": "S3-C05",
          "pointsAwarded": 3,
          "evidence": [
            "README.md:115-156 documents the action endpoints, supported methods, payload examples, validation errors, idempotency behavior, queue-first responses and delivery-status polling."
          ]
        },
        {
          "id": "S3-D01",
          "pointsAwarded": 4,
          "evidence": [
            "Application auth remains on bot routes in src/routes/bot-routes.ts:49-123; queue-first submission is implemented at src/services/registration-service.ts:494-577; status polling is preserved at lines 579-602; retry and dispatch pacing remain in src/services/delivery-service.ts:455-591."
          ]
        },
        {
          "id": "S3-D02",
          "pointsAwarded": 2,
          "evidence": [
            "The stable error envelope with code, message, details and requestId is implemented in src/lib/errors.ts:40-61. However, database errors expose Prisma code/meta at src/lib/errors.ts:28-34, and several Telegram mapping paths return raw provider error messages in src/services/registration-service.ts:84-92 and src/routes/istina-compat-routes.ts:181-185."
          ]
        },
        {
          "id": "S3-D03",
          "pointsAwarded": 3,
          "evidence": [
            "The default registry contains only sendMessage, editMessageText and deleteMessage in src/lib/outbound-actions.ts:3-7. Submission checks the resolved allowlist before queueing in src/services/registration-service.ts:500-508."
          ]
        }
      ]
    },
    {
      "reviewerId": "v7-review-vz-626a27-b",
      "total": 28,
      "checks": [
        {
          "id": "S3-C01",
          "pointsAwarded": 6,
          "evidence": [
            "Validation is centralized in src/lib/outbound-actions.ts and invoked by submitOutboundAction before registration lookup and delivery creation in src/services/registration-service.ts."
          ]
        },
        {
          "id": "S3-C02",
          "pointsAwarded": 3,
          "evidence": [
            "The primary action route and worker are generic, and the default allowlist is centralized in src/lib/outbound-actions.ts. The compatibility facade duplicates chat/message schemas in src/routes/istina-compat-routes.ts."
          ]
        },
        {
          "id": "S3-C03",
          "pointsAwarded": 4,
          "evidence": [
            "Unit tests cover payload validation in test/outbound-actions.test.ts. Integration tests cover validation, queueing, delivery, duplicate idempotency, and conflicts in test/integration/gateway.integration.test.ts."
          ]
        },
        {
          "id": "S3-C04",
          "pointsAwarded": 3,
          "evidence": [
            "The primary route, submit service, and worker are method-generic. Adding an allowed method is localized to the registry/configuration and its schema branch in src/lib/outbound-actions.ts."
          ]
        },
        {
          "id": "S3-C05",
          "pointsAwarded": 3,
          "evidence": [
            "README.md and HOWTOSETUP.md document all three methods, payload examples, inline edit targets, validation errors, idempotency behavior, queue-first statuses, retries, and delivery polling."
          ]
        },
        {
          "id": "S3-D01",
          "pointsAwarded": 4,
          "evidence": [
            "Application authentication and tenant/application scoping remain in src/plugins/auth.ts and src/services/registration-service.ts. Queue-first responses, delivery status polling, retry handling, rate-limit pacing, and existing bot endpoints remain present."
          ]
        },
        {
          "id": "S3-D02",
          "pointsAwarded": 2,
          "evidence": [
            "src/lib/errors.ts preserves the stable error.code/error.message/details/requestId envelope and public models omit bot tokens. Public delivery responses expose lastError and telegramResponse, which are populated from raw Error.message or upstream Telegram details in src/services/delivery-service.ts."
          ]
        },
        {
          "id": "S3-D03",
          "pointsAwarded": 3,
          "evidence": [
            "The default allowlist contains only sendMessage, editMessageText, and deleteMessage. Application allowlists are intersected with the configured global list, and unsupported provisioning methods are rejected in src/services/admin-service.ts."
          ]
        }
      ]
    }
  ],
  "findings": [
    {
      "rootCauseId": "v7-review-vz-626a27-a-finding-1",
      "severity": "note",
      "title": "Reviewer finding",
      "evidence": [
        "src/lib/errors.ts:28-34",
        "src/services/registration-service.ts:84-92",
        "src/routes/istina-compat-routes.ts:181-185"
      ],
      "affectedCheckIds": []
    },
    {
      "rootCauseId": "v7-review-vz-626a27-b-finding-1",
      "severity": "note",
      "title": "Reviewer finding",
      "evidence": [],
      "affectedCheckIds": []
    },
    {
      "rootCauseId": "v7-review-vz-626a27-b-finding-2",
      "severity": "note",
      "title": "Reviewer finding",
      "evidence": [],
      "affectedCheckIds": []
    }
  ],
  "blind": true
}
