{
  "schemaVersion": 1,
  "benchmarkId": "benchmark-v7-luna-xhigh-n3-2026-09-01",
  "blindId": "vz-a2b788",
  "scenario": "new",
  "workspaceCommit": "178411826a9a2aadd6b2c3c153ba3193733ee2da",
  "setupCommit": "178411826a9a2aadd6b2c3c153ba3193733ee2da",
  "contractSha256": "81808e2de1a329b539e7ab9e6f367833c4324aeb74e64b28645457d932265703",
  "reviewPasses": [
    {
      "reviewerId": "v7-review-vz-a2b788-a",
      "total": 23,
      "checks": [
        {
          "id": "N3-C01",
          "pointsAwarded": 6,
          "evidence": [
            "C:/Users/nikit/devdev/prist-benchmark-control/evidence/benchmark-v7-luna-xhigh-n3-2026-09-01/review-inputs/vz-a2b788/app.js:22-42 separates DOM references and application state; app.js:76-107 contains persistence; app.js:203-227 handles derived rendering."
          ]
        },
        {
          "id": "N3-C02",
          "pointsAwarded": 4,
          "evidence": [
            "state.books is the authoritative collection; filtering and rendering derive from it (app.js:38-42, 109-123, 203-227), while status changes update the same objects before persistence (app.js:275-289)."
          ]
        },
        {
          "id": "N3-C03",
          "pointsAwarded": 0,
          "evidence": [
            "package.json:7-9 defines only npm start. The supplied objective receipt reports the required test command as missing in all three repetitions; no direct test files are present in the normalized workspace."
          ]
        },
        {
          "id": "N3-C04",
          "pointsAwarded": 3,
          "evidence": [
            "Books use a structured record with id, title, author, status, and createdAt (app.js:54-73); statuses are centralized in STATUSES/statusMeta (app.js:1-20), and filtering/search are already isolated from persistence (app.js:109-123, 313-321)."
          ]
        },
        {
          "id": "N3-C05",
          "pointsAwarded": 1,
          "evidence": [
            "README.md:5-19 accurately documents Node.js, local start, URL, stopping, and storage. It does not document install, test, build, or type/package checks."
          ]
        },
        {
          "id": "N3-D01",
          "pointsAwarded": 4,
          "evidence": [
            "index.html:145-180 contains the three requested visible board columns; app.js:244-289 implements adding and status movement; the receipt records successful add, movement, reload, restart, multiple-book, validation, and Russian-copy checks. Search and delete remain related reading-list features."
          ]
        },
        {
          "id": "N3-D02",
          "pointsAwarded": 3,
          "evidence": [
            "Inputs have labels and required attributes (index.html:43-52); visible focus styling covers buttons, inputs, and selects (styles.css:57-62); native controls provide the keyboard path; empty states are rendered per status (app.js:185-200); validation focuses the missing field and announces an understandable message (app.js:250-253, index.html:60)."
          ]
        },
        {
          "id": "N3-D03",
          "pointsAwarded": 2,
          "evidence": [
            "Persistence uses a localStorage key without secrets or permissions (app.js:1, 76-106); the server binds to 127.0.0.1 (server.mjs:5, 37). styles.css:1 imports Google Fonts, creating a nonessential external network dependency."
          ]
        }
      ]
    },
    {
      "reviewerId": "v7-review-vz-a2b788-b",
      "total": 25,
      "checks": [
        {
          "id": "N3-C01",
          "pointsAwarded": 6,
          "evidence": [
            "index.html defines the UI structure and labels; app.js owns state, rendering, and event handling; server.mjs only serves local static files.",
            "app.js separates loadBooks/saveBooks localStorage operations from UI rendering and interaction handlers."
          ]
        },
        {
          "id": "N3-C02",
          "pointsAwarded": 4,
          "evidence": [
            "state.books is the central collection, with each book carrying a single status field in app.js:38-42 and app.js:67-73.",
            "Counts, columns, transitions, and persistence all derive from or update the same state.books records."
          ]
        },
        {
          "id": "N3-C03",
          "pointsAwarded": 2,
          "evidence": [
            "The frozen receipt reports add, transition, reload, and restart checks passing in all three repetitions.",
            "The normalized workspace contains no project test files and package.json exposes only a start script, so there is no project-owned direct test suite."
          ]
        },
        {
          "id": "N3-C04",
          "pointsAwarded": 2,
          "evidence": [
            "The normalized book shape and status metadata are centralized, allowing additions without resetting stored books.",
            "Future fields would require updating normalizeBook, rendering, and hard-coded status structures, so extensibility is only partial."
          ]
        },
        {
          "id": "N3-C05",
          "pointsAwarded": 1,
          "evidence": [
            "README documents Node.js 18+, npm start, the local URL, stopping the service, and local storage.",
            "package.json has no test, build, or typecheck scripts, and README provides no corresponding procedures; the receipt marks those checks missing."
          ]
        },
        {
          "id": "N3-D01",
          "pointsAwarded": 4,
          "evidence": [
            "index.html contains visible sections titled Хочу прочитать, Читаю, and Прочитано.",
            "The frozen receipt reports add, state movement, reload persistence, restart persistence, and independent multiple-book behavior passing in all three repetitions."
          ]
        },
        {
          "id": "N3-D02",
          "pointsAwarded": 3,
          "evidence": [
            "Inputs have Russian labels and required attributes; app.js provides Russian validation feedback and focuses the missing field.",
            "CSS defines visible keyboard focus styles, while the form message, toast, and empty-state regions provide status and error feedback."
          ]
        },
        {
          "id": "N3-D03",
          "pointsAwarded": 3,
          "evidence": [
            "app.js stores only book data in browser localStorage; server.mjs is a loopback static server with no credentials, permissions, or external data API.",
            "The stylesheet has system-font fallbacks, so the optional remote font import is not required for product operation."
          ]
        }
      ]
    }
  ],
  "findings": [
    {
      "rootCauseId": "v7-review-vz-a2b788-a-finding-1",
      "severity": "note",
      "title": "Reviewer finding",
      "evidence": [
        "package.json:7-9 contains only the start script; the supplied receipt marks tests missing in all three repetitions."
      ],
      "affectedCheckIds": []
    },
    {
      "rootCauseId": "v7-review-vz-a2b788-a-finding-2",
      "severity": "note",
      "title": "Reviewer finding",
      "evidence": [
        "README.md:5-19 documents start and storage but contains no install, test, build, or type/package-check instructions."
      ],
      "affectedCheckIds": []
    },
    {
      "rootCauseId": "v7-review-vz-a2b788-a-finding-3",
      "severity": "note",
      "title": "Reviewer finding",
      "evidence": [
        "styles.css:1 uses a Google Fonts @import; styles.css:42 provides a fallback font family."
      ],
      "affectedCheckIds": []
    },
    {
      "rootCauseId": "v7-review-vz-a2b788-b-finding-1",
      "severity": "note",
      "title": "Reviewer finding",
      "evidence": [],
      "affectedCheckIds": []
    },
    {
      "rootCauseId": "v7-review-vz-a2b788-b-finding-2",
      "severity": "note",
      "title": "Reviewer finding",
      "evidence": [],
      "affectedCheckIds": []
    },
    {
      "rootCauseId": "v7-review-vz-a2b788-b-finding-3",
      "severity": "note",
      "title": "Reviewer finding",
      "evidence": [],
      "affectedCheckIds": []
    },
    {
      "rootCauseId": "v7-review-vz-a2b788-b-finding-4",
      "severity": "note",
      "title": "Reviewer finding",
      "evidence": [],
      "affectedCheckIds": []
    }
  ],
  "blind": true
}
